{
  "$schema": "http://json-schema.org/draft-07/schema#",
  "type": "object",
  "properties": {
    "keywords": {
      "type": "object",
      "properties": {
        "news": { "type": "string", "description": "News keywords filter (comma-separated, empty = no filter)" },
        "x": { "type": "string", "description": "X/Twitter search keywords (comma-separated)" }
      }
    },
    "fetch": {
      "type": "object",
      "properties": {
        "maxItemsPerSource": { "type": "number", "minimum": 1, "maximum": 20, "default": 20 },
        "timeRange": { "type": "string", "enum": ["1d", "3d", "7d"], "default": "7d" },
        "summaryStyle": { "type": "string", "enum": ["brief", "detailed", "keywords"], "default": "detailed" }
      }
    },
    "sources": {
      "type": "object",
      "properties": {
        "rss": {
          "type": "object",
          "properties": {
            "enabled": { "type": "boolean" },
            "feeds": { "type": "array", "items": { "type": "string" } }
          }
        },
        "ve2x": {
          "type": "object",
          "properties": {
            "enabled": { "type": "boolean" },
            "feeds": { "type": "array", "items": { "type": "string" } }
          }
        },
        "linuxDo": {
          "type": "object",
          "properties": {
            "enabled": { "type": "boolean" },
            "feeds": { "type": "array", "items": { "type": "string" } }
          }
        },
        "reddit": {
          "type": "object",
          "properties": {
            "enabled": { "type": "boolean" },
            "feeds": { "type": "array", "items": { "type": "string" } }
          }
        },
        "productHunt": {
          "type": "object",
          "properties": {
            "enabled": { "type": "boolean" },
            "feeds": { "type": "array", "items": { "type": "string" } }
          }
        },
        "aiHot": {
          "type": "object",
          "properties": {
            "enabled": { "type": "boolean", "default": true },
            "baseUrl": { "type": "string", "default": "https://aihot.virxact.com" },
            "take": { "type": "number", "minimum": 1, "maximum": 100, "default": 50 }
          }
        },
        "hex2077": {
          "type": "object",
          "properties": {
            "enabled": { "type": "boolean", "default": true },
            "feeds": { "type": "array", "items": { "type": "string" } }
          }
        },
        "twitter": {
          "type": "object",
          "properties": {
            "enabled": { "type": "boolean" }
          }
        },
        "githubTrending": {
          "type": "object",
          "properties": {
            "enabled": { "type": "boolean" },
            "languages": { "type": "array", "items": { "type": "string" } }
          }
        },
        "hackerNews": {
          "type": "object",
          "properties": {
            "enabled": { "type": "boolean" }
          }
        }
      }
    },
    "curation": {
      "type": "object",
      "properties": {
        "profile": { "type": "string", "enum": ["ai-developer"], "default": "ai-developer" },
        "maxHighlights": { "type": "number", "minimum": 3, "maximum": 12, "default": 8 },
        "minScore": { "type": "number", "minimum": 1, "maximum": 100, "default": 45 }
      }
    },
    "dedup": {
      "type": "object",
      "properties": {
        "historyDays": { "type": "number", "minimum": 1, "maximum": 30, "default": 7 }
      }
    },
    "output": {
      "type": "object",
      "properties": {
        "rssPath": { "type": "string", "default": "output/news-digest.xml" },
        "dailyDir": { "type": "string", "default": "docs/daily" },
        "topicStatsPath": { "type": "string", "default": "data/topic-stats-history.json" },
        "readmePath": { "type": "string", "default": "README.md" },
        "updateReadme": { "type": "boolean", "default": true }
      }
    },
    "push": {
      "type": "object",
      "properties": {
        "telegram": {
          "type": "object",
          "properties": {
            "enabled": { "type": "boolean", "default": false }
          }
        },
        "feishu": {
          "type": "object",
          "properties": {
            "enabled": { "type": "boolean", "default": false }
          }
        },
        "email": {
          "type": "object",
          "properties": {
            "enabled": { "type": "boolean", "default": false },
            "from": { "type": "string" },
            "to": { "type": "string" }
          }
        }
      }
    }
  }
}
