{
  "$schema": "./config.schema.json",
  "keywords": {
    "news": "ai,llm,agent,coding,code",
    "x": "ai,llm,agent,coding"
  },
  "fetch": {
    "maxItemsPerSource": 20,
    "timeRange": "1d",
    "summaryStyle": "detailed"
  },
  "sources": {
    "rss": {
      "enabled": false,
      "feeds": []
    },
    "ve2x": {
      "enabled": true,
      "feeds": ["https://www.v2ex.com/index.xml"]
    },
    "linuxDo": {
      "enabled": true,
      "feeds": ["https://linux.do/latest.rss"]
    },
    "reddit": {
      "enabled": true,
      "feeds": [
        "https://www.reddit.com/r/artificial/.rss",
        "https://www.reddit.com/r/MachineLearning/.rss",
        "https://www.reddit.com/r/LocalLLaMA/.rss",
        "https://www.reddit.com/r/ProgrammingLanguages/.rss",
        "https://www.reddit.com/r/compsci/.rss"
      ]
    },
    "productHunt": {
      "enabled": true,
      "feeds": ["https://www.producthunt.com/feed"]
    },
    "aiHot": {
      "enabled": true,
      "baseUrl": "https://aihot.virxact.com",
      "take": 50
    },
    "hex2077": {
      "enabled": true,
      "feeds": ["https://hex2077.dev/rss-zh-CN.xml"]
    },
    "twitter": {
      "enabled": false
    },
    "githubTrending": {
      "enabled": true,
      "languages": ["python", "javascript", "typescript", "go", "csharp", "rust", "vue", "react"]
    },
    "hackerNews": {
      "enabled": true
    }
  },
  "curation": {
    "profile": "ai-developer",
    "maxHighlights": 8,
    "minScore": 45
  },
  "dedup": {
    "historyDays": 7
  },
  "output": {
    "rssPath": "output/news-digest.xml",
    "dailyDir": "docs/daily",
    "topicStatsPath": "data/topic-stats-history.json",
    "readmePath": "README.md",
    "updateReadme": true
  },
  "push": {
    "telegram": {
      "enabled": true
    },
    "email": {
      "enabled": false,
      "from": "Self News <noreply@yourdomain.com>",
      "to": "your-email@example.com"
    }
  }
}
